{
  "id": "cmp_d2spwhym",
  "mot_id": "unt_tq49ggmr",
  "forme_resultat_id": "frm_48ys87jh",
  "type_analyse": "synchronique",
  "preferee": true,
  "fait": {
    "confiance": "probable",
    "etat_relecture": "relu",
    "sources": [],
    "note_interne": "Wikidata ne porte pas ce fait (consulté le 12 octobre 2026, ADR 0060) : aucune déclaration « combine les lexèmes » (P5238) sur « autopsie » (L25553). Non publiable tant que Wikidata ne le porte pas."
  },
  "parties": [
    {
      "rang": 1,
      "unite_id": "unt_y051tbbp",
      "sens_id": "sns_7sv7teda",
      "forme_id": "frm_7d4cshb5",
      "segment_debut": 0,
      "segment_fin": 3
    },
    {
      "rang": 2,
      "unite_id": "unt_tv44kfgq",
      "sens_id": "sns_5hc5aypv",
      "forme_id": "frm_3ngfvtnc",
      "segment_debut": 3,
      "segment_fin": 8
    }
  ],
  "transformations": [
    {
      "id": "trf_bpamzcp6",
      "rang_partie": 1,
      "type_code": "elision",
      "ordre": 1,
      "libelles": {
        "fr": {
          "texte": "Le o final de auto- s’élide devant -opsie."
        }
      }
    }
  ],
  "libelles": {
    "fr": {
      "sens_litteral": "vue par soi-même",
      "explication_courte": "Du grec autopsía, « action de voir de ses propres yeux ».",
      "explication_detaillee": "Le grec autós signifie « soi-même », et ópsis « vue ». L’autopsía était le fait de constater par soi-même. Le mot s’est spécialisé en médecine : le médecin voit de ses yeux, dans le corps, ce qui a causé la mort."
    }
  }
}
