{
  "id": "cmp_mv6wrp0d",
  "mot_id": "unt_cwyj7vw7",
  "forme_resultat_id": "frm_gnvwthjw",
  "type_analyse": "synchronique",
  "preferee": true,
  "fait": {
    "confiance": "etablie",
    "etat_relecture": "brouillon",
    "sources": [
      {
        "source_id": "src_6zfwd3mp",
        "localisation": null
      }
    ],
    "note_interne": "À vérifier : entrée « lithomancie » du TLFi, localisation à renseigner."
  },
  "parties": [
    {
      "rang": 1,
      "unite_id": "unt_6mh6164x",
      "sens_id": "sns_c0n9b4ax",
      "forme_id": "frm_ddq28rv9"
    },
    {
      "rang": 2,
      "unite_id": "unt_thep0hgb",
      "sens_id": "sns_84v8ta9x",
      "forme_id": "frm_wm9n3s05"
    }
  ],
  "libelles": {
    "fr": {
      "sens_litteral": "divination par la pierre",
      "explication_courte": "Formé de litho-, « pierre », et de -mancie, « divination »."
    }
  }
}
