{
  "id": "cmp_sb8rcvq3",
  "mot_id": "unt_843nq8sf",
  "forme_resultat_id": "frm_ynsz9r95",
  "type_analyse": "synchronique",
  "preferee": true,
  "fait": {
    "confiance": "etablie",
    "etat_relecture": "relu",
    "sources": [],
    "note_interne": "À vérifier : entrée « lexicographe » du TLFi, localisation à renseigner. Wikidata ne porte pas ce fait (consulté le 10 octobre 2026, ADR 0060) : aucune déclaration « combine les lexèmes » sur « lexicographe » (L26882). Non publiable tant que Wikidata ne le porte pas."
  },
  "parties": [
    {
      "rang": 1,
      "unite_id": "unt_mzg58zsy",
      "sens_id": "sns_ma19v0wx",
      "forme_id": "frm_d552dq6r",
      "segment_debut": 0,
      "segment_fin": 6
    },
    {
      "rang": 2,
      "unite_id": "unt_6jtssz1q",
      "sens_id": "sns_ws8dq9zy",
      "forme_id": "frm_rzpfjxff",
      "segment_debut": 6,
      "segment_fin": 12
    }
  ],
  "libelles": {
    "fr": {
      "sens_litteral": "qui écrit les mots",
      "explication_courte": "Du grec léxis, « mot », et gráphein, « écrire ».",
      "explication_detaillee": "Le grec léxis désigne le mot, et gráphein signifie « écrire ». Le lexicographe écrit sur les mots : il rédige des dictionnaires."
    }
  }
}
