{
  "id": "cmp_n33xwwhg",
  "mot_id": "unt_aesemm9h",
  "forme_resultat_id": "frm_5zhrw010",
  "type_analyse": "synchronique",
  "preferee": true,
  "fait": {
    "confiance": "etablie",
    "etat_relecture": "relu",
    "sources": [],
    "note_interne": "À vérifier : entrée « sympathie » du TLFi, localisation à renseigner. Wikidata ne porte pas ce fait (consulté le 10 octobre 2026, ADR 0060) : aucune déclaration « combine les lexèmes » sur « sympathie » (L21610). Non publiable tant que Wikidata ne le porte pas."
  },
  "parties": [
    {
      "rang": 1,
      "unite_id": "unt_m6c8rjvy",
      "sens_id": "sns_zq165rwy",
      "forme_id": "frm_2cg9hpbn",
      "segment_debut": 0,
      "segment_fin": 3
    },
    {
      "rang": 2,
      "unite_id": "unt_pxw8gq61",
      "sens_id": "sns_vn184vz5",
      "forme_id": "frm_4qbjm9zf",
      "segment_debut": 3,
      "segment_fin": 9
    }
  ],
  "transformations": [
    {
      "id": "trf_fjxhr9nj",
      "rang_partie": 1,
      "type_code": "allomorphie",
      "ordre": 1,
      "libelles": {
        "fr": {
          "texte": "Devant le p de -pathie, syn- prend la forme sym-."
        }
      }
    }
  ],
  "libelles": {
    "fr": {
      "sens_litteral": "affection partagée",
      "explication_courte": "Du grec sumpátheia : sún, « avec », devenu sum- devant p, et páthos, « ce qu’on éprouve ».",
      "explication_detaillee": "Le grec sún signifie « avec », et páthos « ce qu’on éprouve ». La sympathie, c’est éprouver avec l’autre, se sentir proche de lui. Devant le p, syn- devient sym- : c’est une allomorphie."
    }
  }
}
