{
  "id": "cmp_tb5884qv",
  "mot_id": "unt_j9qz3wbx",
  "forme_resultat_id": "frm_ddfbbp9j",
  "type_analyse": "synchronique",
  "preferee": true,
  "fait": {
    "confiance": "etablie",
    "etat_relecture": "relu",
    "sources": [],
    "note_interne": "À vérifier : entrée « antonymie » du TLFi, localisation à renseigner. Wikidata ne porte pas ce fait (consulté le 10 octobre 2026, ADR 0060) : aucune déclaration « combine les lexèmes » sur « antonymie » (sans lexème). Non publiable tant que Wikidata ne le porte pas."
  },
  "parties": [
    {
      "rang": 1,
      "unite_id": "unt_j9efe2gf",
      "sens_id": "sns_bkm03yf0",
      "forme_id": "frm_9ne7yzeq",
      "segment_debut": 0,
      "segment_fin": 3
    },
    {
      "rang": 2,
      "unite_id": "unt_n7h1qr6w",
      "sens_id": "sns_h3cdqvez",
      "forme_id": "frm_pa0ppgbf",
      "segment_debut": 3,
      "segment_fin": 9
    }
  ],
  "transformations": [
    {
      "id": "trf_2sfkybpm",
      "rang_partie": 1,
      "type_code": "elision",
      "ordre": 1,
      "libelles": {
        "fr": {
          "texte": "Le i final de anti- s’élide devant -onymie."
        }
      }
    }
  ],
  "libelles": {
    "fr": {
      "sens_litteral": "noms contraires",
      "explication_courte": "Du grec antí, « contre », et ónoma, « nom ».",
      "explication_detaillee": "Le grec antí signifie « contre », et ónoma « nom ». L’antonymie est la relation qui unit deux mots de sens opposé, comme jour et nuit. Elle fait pendant à la synonymie."
    }
  }
}
