{
  "id": "cmp_kfnwr7tg",
  "mot_id": "unt_jf5272xq",
  "forme_resultat_id": "frm_376815gz",
  "type_analyse": "synchronique",
  "preferee": true,
  "fait": {
    "confiance": "etablie",
    "etat_relecture": "brouillon",
    "sources": [
      {
        "source_id": "src_6zfwd3mp",
        "localisation": "entrée « anthropobiologie »"
      }
    ],
    "note_interne": "À vérifier : entrée « anthropobiologie » du TLFi, localisation à confirmer. Explication détaillée rédigée sans copie de source, à relire et à confirmer dans le TLFi (dates et attributions comprises)."
  },
  "parties": [
    {
      "rang": 1,
      "unite_id": "unt_feew0asz",
      "sens_id": "sns_xmnme5fm",
      "forme_id": "frm_rvvr1ycj",
      "segment_debut": 0,
      "segment_fin": 8
    },
    {
      "rang": 2,
      "unite_id": "unt_hbcnmcc7",
      "sens_id": "sns_z6x4nf1x",
      "forme_id": "frm_380t4yaz",
      "segment_debut": 8,
      "segment_fin": 16
    }
  ],
  "libelles": {
    "fr": {
      "sens_litteral": "biologie de l’être humain",
      "explication_courte": "Un mot déjà découvert devient un ingrédient : anthropo- s’ajoute à biologie.",
      "explication_detaillee": "Le préfixe anthropo-, tiré du grec ánthrōpos, se place devant un mot que vous connaissez déjà : la biologie. Le résultat désigne la biologie appliquée à l’être humain. C’est un mot construit à l’époque moderne, par assemblage de deux éléments savants."
    }
  }
}
