{
  "id": "cmp_0fys723a",
  "mot_id": "unt_agp7mmja",
  "forme_resultat_id": "frm_2bwwr443",
  "type_analyse": "synchronique",
  "preferee": true,
  "fait": {
    "confiance": "etablie",
    "etat_relecture": "relu",
    "sources": [],
    "note_interne": "À vérifier : entrée « thermologie » du TLFi, localisation à renseigner. Wikidata ne porte pas ce fait (consulté le 10 octobre 2026, ADR 0060) : aucune déclaration « combine les lexèmes » sur « thermologie » (sans lexème). Non publiable tant que Wikidata ne le porte pas."
  },
  "parties": [
    {
      "rang": 1,
      "unite_id": "unt_pnj306rh",
      "sens_id": "sns_z3hj8gkv",
      "forme_id": "frm_17yjnxej",
      "segment_debut": 0,
      "segment_fin": 6
    },
    {
      "rang": 2,
      "unite_id": "unt_mk61g05z",
      "sens_id": "sns_t9ng9amb",
      "forme_id": "frm_3qgy37m7",
      "segment_debut": 6,
      "segment_fin": 11
    }
  ],
  "libelles": {
    "fr": {
      "sens_litteral": "étude de la chaleur",
      "explication_courte": "Formé de thermo-, « chaleur », et de -logie, « étude ».",
      "explication_detaillee": "Le grec thermós signifie « chaud », et logía « étude ». La thermologie est l’étude de la chaleur ; en médecine, elle mesure la température du corps."
    }
  }
}
