{
  "id": "cmp_w4c5vs4k",
  "mot_id": "unt_54rxbkjc",
  "forme_resultat_id": "frm_8y9hg4be",
  "type_analyse": "synchronique",
  "preferee": true,
  "fait": {
    "confiance": "etablie",
    "etat_relecture": "relu",
    "sources": [],
    "note_interne": "À vérifier : entrée « monarchisme » du TLFi, localisation à renseigner. Wikidata ne porte pas ce fait (consulté le 10 octobre 2026, ADR 0060) : aucune déclaration « combine les lexèmes » sur « monarchisme » (sans lexème). Non publiable tant que Wikidata ne le porte pas."
  },
  "parties": [
    {
      "rang": 1,
      "unite_id": "unt_28sa9d85",
      "sens_id": "sns_xseh2azz",
      "forme_id": "frm_3tvsyahf",
      "segment_debut": 0,
      "segment_fin": 7
    },
    {
      "rang": 2,
      "unite_id": "unt_vytqjb98",
      "sens_id": "sns_770ct01j",
      "forme_id": "frm_fsmc83tp",
      "segment_debut": 7,
      "segment_fin": 11
    }
  ],
  "transformations": [
    {
      "id": "trf_bnjt03vn",
      "rang_partie": 1,
      "type_code": "elision",
      "ordre": 1,
      "libelles": {
        "fr": {
          "texte": "La finale -ie de monarchie tombe devant -isme."
        }
      }
    }
  ],
  "libelles": {
    "fr": {
      "sens_litteral": "doctrine de la monarchie",
      "explication_courte": "Un mot déjà découvert devient un ingrédient : monarchie reçoit -isme.",
      "explication_detaillee": "Le suffixe -isme désigne une doctrine ; il s’ajoute à monarchie, le pouvoir d’un seul. Le monarchisme est la doctrine des partisans de la monarchie."
    }
  }
}
