{
  "id": "cmp_yxsxa7jh",
  "mot_id": "unt_jp89rc8t",
  "forme_resultat_id": "frm_kp4e8536",
  "type_analyse": "synchronique",
  "preferee": true,
  "fait": {
    "confiance": "etablie",
    "etat_relecture": "brouillon",
    "sources": [],
    "note_interne": "À vérifier : entrée « otoscope » du TLFi, localisation à renseigner. Wikidata ne porte pas ce fait (consulté le 10 octobre 2026, ADR 0060) : aucune déclaration « combine les lexèmes » sur « otoscope » (sans lexème). Non publiable tant que Wikidata ne le porte pas."
  },
  "parties": [
    {
      "rang": 1,
      "unite_id": "unt_wpgvw6zs",
      "sens_id": "sns_b1n3vngq",
      "forme_id": "frm_sge3fyc6",
      "segment_debut": 0,
      "segment_fin": 3
    },
    {
      "rang": 2,
      "unite_id": "unt_g10m2yeg",
      "sens_id": "sns_19cdy8tv",
      "forme_id": "frm_cc2e3r1v",
      "segment_debut": 3,
      "segment_fin": 8
    }
  ],
  "libelles": {
    "fr": {
      "sens_litteral": "qui observe l’oreille",
      "explication_courte": "Du grec oûs, « oreille », et skopeîn, « observer ».",
      "explication_detaillee": "Le grec oûs désigne l’oreille, et skopeîn signifie « observer ». L’otoscope sert à observer le conduit de l’oreille."
    }
  }
}
