{
  "id": "cmp_8qn49j6v",
  "mot_id": "unt_tcape0tp",
  "forme_resultat_id": "frm_c5kp2c2z",
  "type_analyse": "synchronique",
  "preferee": true,
  "fait": {
    "confiance": "etablie",
    "etat_relecture": "relu",
    "sources": [],
    "note_interne": "À vérifier : entrée « monarchiste » du TLFi, localisation à renseigner. Wikidata ne porte pas ce fait (consulté le 10 octobre 2026, ADR 0060) : aucune déclaration « combine les lexèmes » sur « monarchiste » (sans lexème). Non publiable tant que Wikidata ne le porte pas."
  },
  "parties": [
    {
      "rang": 1,
      "unite_id": "unt_28sa9d85",
      "sens_id": "sns_xseh2azz",
      "forme_id": "frm_3tvsyahf",
      "segment_debut": 0,
      "segment_fin": 7
    },
    {
      "rang": 2,
      "unite_id": "unt_wqz6cnsr",
      "sens_id": "sns_eschctms",
      "forme_id": "frm_vj4gj4zb",
      "segment_debut": 7,
      "segment_fin": 11
    }
  ],
  "transformations": [
    {
      "id": "trf_m72r0qdr",
      "rang_partie": 1,
      "type_code": "elision",
      "ordre": 1,
      "libelles": {
        "fr": {
          "texte": "La finale -ie de monarchie tombe devant -iste."
        }
      }
    }
  ],
  "libelles": {
    "fr": {
      "sens_litteral": "qui pratique la monarchie",
      "explication_courte": "Un mot déjà découvert devient un ingrédient : monarchie reçoit -iste.",
      "explication_detaillee": "Le suffixe -iste désigne celui qui défend une idée ; il s’ajoute à monarchie. Le monarchiste est partisan de la monarchie."
    }
  }
}
