{
  "id": "cmp_vsh4m1rh",
  "mot_id": "unt_kd95jre4",
  "forme_resultat_id": "frm_evntyr75",
  "type_analyse": "synchronique",
  "preferee": true,
  "fait": {
    "confiance": "etablie",
    "etat_relecture": "brouillon",
    "sources": [],
    "note_interne": "À vérifier : entrée « hydromancie » du TLFi, localisation à renseigner. Wikidata ne porte pas ce fait (consulté le 10 octobre 2026, ADR 0060) : aucune déclaration « combine les lexèmes » sur « hydromancie » (sans lexème). Non publiable tant que Wikidata ne le porte pas."
  },
  "parties": [
    {
      "rang": 1,
      "unite_id": "unt_kh2jf5en",
      "sens_id": "sns_7gtcjrfg",
      "forme_id": "frm_f663egwt",
      "segment_debut": 0,
      "segment_fin": 5
    },
    {
      "rang": 2,
      "unite_id": "unt_thep0hgb",
      "sens_id": "sns_84v8ta9x",
      "forme_id": "frm_wm9n3s05",
      "segment_debut": 5,
      "segment_fin": 11
    }
  ],
  "libelles": {
    "fr": {
      "sens_litteral": "divination par l’eau",
      "explication_courte": "Du grec húdōr, « eau », et manteía, « divination ».",
      "explication_detaillee": "Le grec húdōr désigne l’eau, et manteía la divination. L’hydromancie prétend lire l’avenir dans l’eau."
    }
  }
}
