{
  "id": "cmp_dtk8njxc",
  "mot_id": "unt_g5caarxs",
  "forme_resultat_id": "frm_qnwvdvgk",
  "type_analyse": "synchronique",
  "preferee": true,
  "fait": {
    "confiance": "etablie",
    "etat_relecture": "brouillon",
    "sources": [
      {
        "source_id": "src_6zfwd3mp",
        "localisation": "entrée « photophone »"
      }
    ],
    "note_interne": "À vérifier : entrée « photophone » du TLFi, localisation à confirmer. Explication détaillée rédigée sans copie de source, à relire et à confirmer dans le TLFi (dates et attributions comprises)."
  },
  "parties": [
    {
      "rang": 1,
      "unite_id": "unt_78vz8xyv",
      "sens_id": "sns_4m0rv8vh",
      "forme_id": "frm_5gygmbbv",
      "segment_debut": 0,
      "segment_fin": 5
    },
    {
      "rang": 2,
      "unite_id": "unt_3qa8qenz",
      "sens_id": "sns_5j2ng941",
      "forme_id": "frm_48j9bjyc",
      "segment_debut": 5,
      "segment_fin": 10
    }
  ],
  "libelles": {
    "fr": {
      "sens_litteral": "voix de la lumière",
      "explication_courte": "Du grec phôs, « lumière », et phōnḗ, « voix ».",
      "explication_detaillee": "Le grec phôs signifie « lumière » et phōnḗ « voix, son ». Le photophone est un appareil inventé en 1880 par Alexander Graham Bell, qui transmet la voix par un faisceau lumineux. Il a précédé la fibre optique."
    }
  }
}
