{
  "id": "cmp_45e2rpc4",
  "mot_id": "unt_s149w1tc",
  "forme_resultat_id": "frm_n2vafqrc",
  "type_analyse": "synchronique",
  "preferee": true,
  "fait": {
    "confiance": "etablie",
    "etat_relecture": "relu",
    "sources": [],
    "note_interne": "À vérifier : entrée « théologue » du TLFi, localisation à confirmer. Explication détaillée rédigée sans copie de source, à relire et à confirmer dans le TLFi (dates et attributions comprises). Wikidata ne porte pas ce fait (consulté le 10 octobre 2026, ADR 0060) : aucune déclaration « combine les lexèmes » sur « théologue » (sans lexème). Non publiable tant que Wikidata ne le porte pas. Repassé en brouillon : la relecture humaine doit rejouer la requête."
  },
  "parties": [
    {
      "rang": 1,
      "unite_id": "unt_3r4j3whs",
      "sens_id": "sns_9ewdgwcn",
      "forme_id": "frm_2jrbrxrc",
      "segment_debut": 0,
      "segment_fin": 4
    },
    {
      "rang": 2,
      "unite_id": "unt_4bdmzv0a",
      "sens_id": "sns_0g2eqv7m",
      "forme_id": "frm_ng53zgpf",
      "segment_debut": 4,
      "segment_fin": 9
    }
  ],
  "libelles": {
    "fr": {
      "sens_litteral": "spécialiste de Dieu",
      "explication_courte": "Du grec theós, « dieu », et -logue, « spécialiste ».",
      "explication_detaillee": "Le suffixe -logue désigne le spécialiste. Le théologue est celui qui pratique la théologie. Il est le nom de personne qui correspond à théologie."
    }
  }
}
