{
  "id": "cmp_qw6k32w5",
  "mot_id": "unt_1g58gy46",
  "forme_resultat_id": "frm_jfa6rwfd",
  "type_analyse": "synchronique",
  "preferee": true,
  "fait": {
    "confiance": "etablie",
    "etat_relecture": "relu",
    "sources": [],
    "note_interne": "À vérifier : entrée « anagramme » du TLFi, localisation à renseigner. Wikidata ne porte pas ce fait (consulté le 10 octobre 2026, ADR 0060) : aucune déclaration « combine les lexèmes » sur « anagramme » (L15309). Non publiable tant que Wikidata ne le porte pas."
  },
  "parties": [
    {
      "rang": 1,
      "unite_id": "unt_7np98nyh",
      "sens_id": "sns_710q0zyt",
      "forme_id": "frm_m5tn9n2b",
      "segment_debut": 0,
      "segment_fin": 3
    },
    {
      "rang": 2,
      "unite_id": "unt_ernd6cxe",
      "sens_id": "sns_5c7yghcv",
      "forme_id": "frm_d8av9w3y",
      "segment_debut": 3,
      "segment_fin": 9
    }
  ],
  "libelles": {
    "fr": {
      "sens_litteral": "lettres remontées",
      "explication_courte": "Du grec anagrammatismós, « transposition de lettres ».",
      "explication_detaillee": "Le grec aná signifie « de nouveau, en remontant », et grámma « lettre ». Une anagramme reprend les lettres d’un mot dans un autre ordre : chien devient niche."
    }
  }
}
