{
  "id": "cmp_5pf95d87",
  "mot_id": "unt_caxr7dvj",
  "forme_resultat_id": "frm_me20qbe6",
  "type_analyse": "synchronique",
  "preferee": true,
  "fait": {
    "confiance": "etablie",
    "etat_relecture": "brouillon",
    "sources": [
      {
        "source_id": "src_6zfwd3mp",
        "localisation": null
      }
    ],
    "note_interne": "À vérifier : entrée « pseudonyme » du TLFi, localisation à renseigner."
  },
  "parties": [
    {
      "rang": 1,
      "unite_id": "unt_7djh0ry7",
      "sens_id": "sns_q117m9xs",
      "forme_id": "frm_7h5rs32a"
    },
    {
      "rang": 2,
      "unite_id": "unt_ak4fdsk0",
      "sens_id": "sns_347fhdwy",
      "forme_id": "frm_4pzmarxj"
    }
  ],
  "transformations": [
    {
      "id": "trf_eehjke71",
      "rang_partie": 1,
      "type_code": "elision",
      "ordre": 1,
      "libelles": {
        "fr": {
          "texte": "Le o final de pseudo- s’élide devant -onyme."
        }
      }
    }
  ],
  "libelles": {
    "fr": {
      "sens_litteral": "faux nom",
      "explication_courte": "Du grec pseudḗs, « faux », et ónoma, « nom »."
    }
  }
}
