{
  "id": "cmp_geakp16j",
  "mot_id": "unt_bar524rn",
  "forme_resultat_id": "frm_4pysyjxp",
  "type_analyse": "synchronique",
  "preferee": true,
  "fait": {
    "confiance": "etablie",
    "etat_relecture": "brouillon",
    "sources": [
      {
        "source_id": "src_6zfwd3mp",
        "localisation": null
      }
    ],
    "note_interne": "À vérifier : entrée « monophonie » du TLFi, localisation à renseigner."
  },
  "parties": [
    {
      "rang": 1,
      "unite_id": "unt_8vpkshzf",
      "sens_id": "sns_td6c0wkj",
      "forme_id": "frm_5cqyxegq"
    },
    {
      "rang": 2,
      "unite_id": "unt_hwtkem8c",
      "sens_id": "sns_4zpmh5ab",
      "forme_id": "frm_maz669v7"
    }
  ],
  "libelles": {
    "fr": {
      "sens_litteral": "seule sonorité",
      "explication_courte": "Formé de mono-, « seul, unique », et de -phonie, « sonorité »."
    }
  }
}
