{
  "id": "cmp_bs07vqxy",
  "mot_id": "unt_4ttzqqhq",
  "forme_resultat_id": "frm_hrfk0cyc",
  "type_analyse": "synchronique",
  "preferee": true,
  "fait": {
    "confiance": "etablie",
    "etat_relecture": "brouillon",
    "sources": [],
    "note_interne": "À vérifier : entrée « antilogie » du TLFi, localisation à renseigner. Wikidata ne porte pas ce fait (consulté le 10 octobre 2026, ADR 0060) : aucune déclaration « combine les lexèmes » sur « antilogie » (sans lexème). Non publiable tant que Wikidata ne le porte pas."
  },
  "parties": [
    {
      "rang": 1,
      "unite_id": "unt_j9efe2gf",
      "sens_id": "sns_bkm03yf0",
      "forme_id": "frm_9ne7yzeq",
      "segment_debut": 0,
      "segment_fin": 4
    },
    {
      "rang": 2,
      "unite_id": "unt_mk61g05z",
      "sens_id": "sns_t9ng9amb",
      "forme_id": "frm_3qgy37m7",
      "segment_debut": 4,
      "segment_fin": 9
    }
  ],
  "libelles": {
    "fr": {
      "sens_litteral": "discours contraire",
      "explication_courte": "Formé de anti-, « contre », et de -logie, « étude »."
    }
  }
}
