{
  "id": "cmp_prx3qpm5",
  "mot_id": "unt_g4012hnq",
  "forme_resultat_id": "frm_smjme0kq",
  "type_analyse": "synchronique",
  "preferee": true,
  "fait": {
    "confiance": "etablie",
    "etat_relecture": "relu",
    "sources": [
      {
        "source_id": "src_6zfwd3mp",
        "localisation": "entrée « géobiologie »"
      }
    ],
    "note_interne": "À vérifier : entrée « géobiologie » du TLFi, localisation à confirmer."
  },
  "parties": [
    {
      "rang": 1,
      "unite_id": "unt_k1ktdn0d",
      "sens_id": "sns_b9rwd12b",
      "forme_id": "frm_p4s3snyd",
      "segment_debut": 0,
      "segment_fin": 3
    },
    {
      "rang": 2,
      "unite_id": "unt_hbcnmcc7",
      "sens_id": "sns_z6x4nf1x",
      "forme_id": "frm_380t4yaz",
      "segment_debut": 3,
      "segment_fin": 11
    }
  ],
  "libelles": {
    "fr": {
      "sens_litteral": "biologie de la terre",
      "explication_courte": "Un mot déjà découvert devient un ingrédient : géo- s’ajoute à biologie."
    }
  }
}
