{
  "id": "cmp_wpemj51s",
  "mot_id": "unt_nyaqpwry",
  "forme_resultat_id": "frm_mteb5wg5",
  "type_analyse": "synchronique",
  "preferee": true,
  "fait": {
    "confiance": "etablie",
    "etat_relecture": "brouillon",
    "sources": [],
    "note_interne": "À vérifier : entrée « homotype » du TLFi, localisation à renseigner. Wikidata ne porte pas ce fait (consulté le 10 octobre 2026, ADR 0060) : aucune déclaration « combine les lexèmes » sur « homotype » (sans lexème). Non publiable tant que Wikidata ne le porte pas."
  },
  "parties": [
    {
      "rang": 1,
      "unite_id": "unt_f0s3zj1k",
      "sens_id": "sns_71mvf6yn",
      "forme_id": "frm_k25v9rz3",
      "segment_debut": 0,
      "segment_fin": 4
    },
    {
      "rang": 2,
      "unite_id": "unt_cx7120nd",
      "sens_id": "sns_1tyve288",
      "forme_id": "frm_kgzpbgy1",
      "segment_debut": 4,
      "segment_fin": 8
    }
  ],
  "libelles": {
    "fr": {
      "sens_litteral": "même modèle",
      "explication_courte": "Formé de homo-, « même », et de -type, « modèle ».",
      "explication_detaillee": "Le grec homós signifie « même », et túpos « type, modèle ». Un homotype est un organe bâti sur le même modèle qu’un autre, qui lui est symétrique."
    }
  }
}
