{
  "id": "cmp_b3dt8k6p",
  "mot_id": "unt_b8eth0n0",
  "forme_resultat_id": "frm_9sa2t6an",
  "type_analyse": "synchronique",
  "preferee": true,
  "fait": {
    "confiance": "etablie",
    "etat_relecture": "relu",
    "sources": [],
    "note_interne": "À vérifier : entrée « polyarchie » du TLFi, localisation à renseigner. Wikidata ne porte pas ce fait (consulté le 10 octobre 2026, ADR 0060) : aucune déclaration « combine les lexèmes » sur « polyarchie » (sans lexème). Non publiable tant que Wikidata ne le porte pas."
  },
  "parties": [
    {
      "rang": 1,
      "unite_id": "unt_81tn2txv",
      "sens_id": "sns_c1p2y6hr",
      "forme_id": "frm_j1ks276z",
      "segment_debut": 0,
      "segment_fin": 4
    },
    {
      "rang": 2,
      "unite_id": "unt_yygt0ren",
      "sens_id": "sns_wgsskjq4",
      "forme_id": "frm_2zf62htv",
      "segment_debut": 4,
      "segment_fin": 10
    }
  ],
  "libelles": {
    "fr": {
      "sens_litteral": "commandement de plusieurs",
      "explication_courte": "Formé de poly-, « nombreux », et de -archie, « commandement ».",
      "explication_detaillee": "Le grec polús signifie « nombreux », et arkhḗ « commandement ». La polyarchie est un gouvernement exercé par plusieurs personnes ou plusieurs groupes."
    }
  }
}
